{
  "claim_count": 35,
  "claims": [
    {
      "authority_class": "MANUAL_INTERNAL:FULL_TEXT",
      "canonical_line_number": 325,
      "canonical_retrieval_path": "corpus/canonical/objects/ING_1fb6b71a35f819248daf/9a9258474a901a3d98150f402030d7f7cf5625a05d9d649dbdf5f19b0f013088/chunks/embedding_ready.jsonl",
      "canonical_text_sha256": "8ee797f13186e0f35f4abaf574977bbc6076116534d8abc1d6ef4ff25d1b8cfb",
      "chunk_id": "ING_1fb6b71a35f819248daf_CH_2d80481262",
      "chunk_type": "TABLE_CHUNK",
      "claim_id": "CLM_014fd651aeacc85ab29ef3a2b0d66b231d1cbcf57375b71758649e089ae993d6",
      "claim_text": "TEŞEKKÜR > 3000 METREDEN UZUN TÜNELLER > 264 ENERJİ MALİYETLERİ AZALTMA ÖNERİLERİ\nAydınlatma Sistemi | Aydınlatma Sistemi |  | Havalandırma (Emisyon ve Kirlilik) | Havalandırma (Emisyon ve Kirlilik)\n\nFaktör | Etkisi |  | Faktör | Etkisi\n\nTünel Uzunluğu | Orta-Yüksek |  | Tünel Uzunluğu | Orta-Yüksek\n\nTüp Sayısı | Yüksek |  | Tünel Eğimi | Düşük\n\nTrafik Hızı | Yüksek |  | Portal Dizaynı | Yüksek\n\nAydınlatma Verimliliği (Işık Kaynağı, yaşı, temizliği v.b.) | Orta |  | Kesit Alanı | Yüksek\n\nAydınlatma Verimliliği (Işık Kaynağı, yaşı, temizliği v.b.) | Orta |  | Tüp Sayısı | Yüksek\n\nÇevresel Etkiler (Parlaklık, İklim v.b.) | Orta |  | Şerit Sayısı | Trafik Hacmi hava hızına bağlı olarak Yüksek\n\nKontrol Metodu (fotosel, fotometre) | Orta |  | Şerit Sayısı | Trafik Hacmi hava hızına bağlı olarak Yüksek\n\nDizayn Standartlarına Uygunluğu | Orta |  | Trafik Hızı | Orta\n\nPortal Dizaynı (Gün ışığı kullanımı) | Orta |  | Trafik Yoğunluğu | Orta\n\n |  |  | Trafik Kompozisyonu | Orta\n\nİşletme Binaları | İşletme Binaları |  | Araçların Emisyon Değerleri | Orta\n\nFaktör | Etkisi |  | Kabul Edilebilir Kirlilik Seviyeleri | Orta\n\nBinalarda Personel Çalışması | Yüksek |  | Havalandırma Yöntemi (Enine,boyuna, karma v.b.) | Orta\n\nSoğutma Gerekliliği | Yüksek |  | Havalandırma Yöntemi (Enine,boyuna, karma v.b.) | Orta\n\nIsıtma Gerekliliği | Orta |  | Çevresel Etkiler (hakim rüzgar yönü, ortam sıcaklığı v.b.) | Orta\n\nAydınlatma | Orta |  | Çevresel Etkiler (hakim rüzgar yönü, ortam sıcaklığı v.b.) | Orta\n\nElektronik Ekipmanlar | Orta |  | Tehlikeli Madde Taşımacılına İzin Verilmesi | Orta\n\nOrtam Sıcaklığı | Yüksek |  |  | \n\nBina Özellikleri | Yüksek |  |  |",
      "conditions": [],
      "document_id": "ING_1fb6b71a35f819248daf",
      "evidence_level": "FULL_TEXT",
      "evidence_strength": "PARTIAL",
      "limitations": [
        "VERBATIM_CANONICAL_PASSAGE_NOT_A_LICENSE_TO_GENERALIZE",
        "SOURCE_CHUNK_TYPE_TABLE_CHUNK",
        "PARTIAL_FOR_ONE_OR_MORE_LINKED_QUESTIONS"
      ],
      "locator": "ING_1fb6b71a35f819248daf:ING_1fb6b71a35f819248daf_CH_2d80481262:canonical=corpus/canonical/objects/ING_1fb6b71a35f819248daf/9a9258474a901a3d98150f402030d7f7cf5625a05d9d649dbdf5f19b0f013088/chunks/embedding_ready.jsonl#L325",
      "page_end": null,
      "page_start": null,
      "provenance_status": "VERIFIED_CANONICAL",
      "qualifiers": [],
      "question_evidence_states": {
        "1.5.2-Q13": "PARTIAL"
      },
      "secondary_section_ids": [
        "5",
        "5.4"
      ],
      "section_id": "1.5.2",
      "sheet_name": null,
      "slide_number": null,
      "source_kind": "MANUAL_INTERNAL",
      "source_section_id": "5.4.2",
      "supporting_question_ids": [
        "1.5.2-Q13"
      ]
    },
    {
      "authority_class": "MANUAL_INTERNAL:FULL_TEXT",
      "canonical_line_number": 94,
      "canonical_retrieval_path": "corpus/canonical/objects/ING_670dfbfd16421be5cb70/1556b6915f8296cdfa2c5603c7c0d7edadb065af3031b0b27ee8a88734f06b1d/chunks/embedding_ready.jsonl",
      "canonical_text_sha256": "5dbf8e4b6a2470827cbb4e79d82ee668a28c4f60a4d2d0f66855da3df7c931a1",
      "chunk_id": "ING_670dfbfd16421be5cb70_CH_a27e5e50f7",
      "chunk_type": "TABLE_CHUNK",
      "claim_id": "CLM_026d2e8214931cdcf038009d4b7c1b21379d701dcbe173187c0d7da72c6b120a",
      "claim_text": "2. Tünel Kazısı Sırasında Çıkan Bazı Yangınlar\nTablo: Çizelge 1. Dünya'da tünel kazısı sırasında çıkan bazı yangınlara örnekler (1,5,9,10,15)\nÇizelge 1. Dünya'da tünel kazısı sırasında çıkan bazı yangınlara örnekler (1,5,9,10,15)\n\nTarih | Tünel | Kaza | Sebebi | Kazali | Maddi Hasar\n\n21/12/69 | Münich Metrosu Bölüm 10 | Sizdirmazlik igin kullanilan ziftin eritilmesi | Propan alevi | 30lüm | 350000f\n\n29/9/69 | Munich Metrosu Bölüm 3 | Sizdirmazlik icin kullamilan ziftin eritilmesi | Propan alevi |  | 1.000000f\n\n11/15/69 | Brenner, Tüneli Avusturya | Plastik sizdirmazlik elemanlarinin yanmasi | Elektrik kontagi | 28lüm | ?\n\n11/6/94 | Great Bell Tüneli Danimarka | TBM'de patlama | Basing hattindaki hidrolik yagin sizmasi ve kaynak |  | TBM ve segmentlerde hasar\n\n15/6/94 | Boston Tüneli USA | Dikey bandin yanmasi | Kaynak | 2yarali | ?\n\n5/7/99 | Tronso Tüneli Norvec | Delicinin yanmasi | Hidrolik yagin ates almasi |  | ?\n\n1956 | Marcinellkömür ocag,Belcika | Yangin | Hidrolik yagin ates almasi | 2610lum | ?\n\n5/3/2002 | Socatop Tüneli Fransa | TBM'in 800m arkasindaki bandin yanmasi | ? | 21yarali | TBM ve segmentlerde zarar\n\n6/8/2003 | Guadarramo Tüneli ispanya | Lokomotifte patlama | Kirilan alternatör | ? | Loko. ve seg. zarar",
      "conditions": [],
      "document_id": "ING_670dfbfd16421be5cb70",
      "evidence_level": "FULL_TEXT",
      "evidence_strength": "PARTIAL",
      "limitations": [
        "VERBATIM_CANONICAL_PASSAGE_NOT_A_LICENSE_TO_GENERALIZE",
        "SOURCE_CHUNK_TYPE_TABLE_CHUNK",
        "PARTIAL_FOR_ONE_OR_MORE_LINKED_QUESTIONS"
      ],
      "locator": "ING_670dfbfd16421be5cb70:ING_670dfbfd16421be5cb70_CH_a27e5e50f7:pages=70;canonical=corpus/canonical/objects/ING_670dfbfd16421be5cb70/1556b6915f8296cdfa2c5603c7c0d7edadb065af3031b0b27ee8a88734f06b1d/chunks/embedding_ready.jsonl#L94",
      "page_end": 70,
      "page_start": 70,
      "provenance_status": "VERIFIED_CANONICAL",
      "qualifiers": [],
      "question_evidence_states": {
        "1.5.2-Q03": "PARTIAL"
      },
      "secondary_section_ids": [
        "2",
        "5.9.1",
        "2.2.1"
      ],
      "section_id": "1.5.2",
      "sheet_name": null,
      "slide_number": null,
      "source_kind": "MANUAL_INTERNAL",
      "source_section_id": "2.2",
      "supporting_question_ids": [
        "1.5.2-Q03"
      ]
    },
    {
      "authority_class": "MANUAL_INTERNAL:FULL_TEXT",
      "canonical_line_number": 105,
      "canonical_retrieval_path": "corpus/canonical/objects/ING_e4e696e67dc8f1675451/1629cc0caf7e6a7b33c82ce36a8618130c5c03e73e3b8b3d5042966e115d4f66/chunks/embedding_ready.jsonl",
      "canonical_text_sha256": "6f2ab7f15f52ed7613bde898a7e972e286e72223fb33a7a604788b18f5980015",
      "chunk_id": "ING_e4e696e67dc8f1675451_CH_53ed8f7c82",
      "chunk_type": "TEXT_CHUNK",
      "claim_id": "CLM_03595ffde44b418eb1d1f4c39f7fbfcee0473699e6e1f1910fa7d3f1513e5162",